"施設名称","施設所在地","施設方書","施設電話番号","施設開設日","診療科目名称","緯度","経度"
"さくら訪問マッサージ大門店","東京都港区浜松町一丁目19番10号","第二古橋ビル5階","03-6809-2042","2013/8/1","あん摩、はり、きゅう","35.657816","139.755794"
"智翠","東京都港区浜松町一丁目20番10号","ライオネス浜松町408",,"2022/4/1","はり、きゅう","35.657756 ","139.756563 "
"鍼灸マッサージ芝東洋院","東京都港区浜松町一丁目27番17号","三和ビル2階","03-3438-3738","1997/3/17","あん摩、はり、きゅう","35.657667","139.755210"
"株式会社ＴＤモバイル　健康管理室","東京都港区浜松町一丁目30番5号","浜松町スクエア5階","03-6830-2500","2011/6/1","あん摩","35.657061","139.756769"
"磯崎マッサージ療院","東京都港区浜松町二丁目2番11号","廣瀬ビル5階","03-3437-6233","2004/10/1","あん摩","35.654764","139.754647"
"ニコニコ指圧マッサージ治療院","東京都港区浜松町二丁目6番10号","第三青野屋ビル1階","03-3431-5528","2010/3/25","あん摩","35.654241","139.755782"
"スマートボディプラス鍼灸マッサージ院","東京都港区浜松町二丁目7番15号","浜松町三電舎ビルディング1階","03-6452-9588","2014/8/18","あん摩、はり、きゅう","35.653915","139.754766"
"ｂｅ　ｓｔｙｌｅ","東京都港区東麻布一丁目4番2号","山田ビル3階","03-6807-4970","2021/5/20","はり、きゅう","35.658050","139.743435"
"ｓａｌｏｎ　ｄｅ　ｍｏｅ　‐ａｚａｂｕ‐","東京都港区東麻布一丁目15番2号","Branshe東麻布102","03-6885-0672","2022/11/8","きゅう、はり","35.656715","139.743250"
"ＯＷＬ鍼灸院","東京都港区東麻布一丁目18番7号","REVER HAYASHI 301",,"2022/8/26","はり、きゅう","35.655733","139.742722"
"鍼灸メディカルセンター","東京都港区東麻布一丁目23番6号",,"03-3585-8901","1989/1/19","あん摩、はり、きゅう","35.656105","139.744532"
"ｎｏｂｏｒｉ鍼灸院","東京都港区東麻布一丁目29番17号","グランクリュー麻布502",,"2022/1/7","はり、きゅう","35.655353","139.742181"
"ｈａｐｐｙｓｌｅｅｐ　ｈａｒｉａｙａｋｏ","東京都港区東麻布一丁目29番17号","グランクリュー麻布302",,"2021/8/8","あん摩、はり、きゅう","35.655353","139.742181"
"キネティック治療院","東京都港区東麻布二丁目3番4号","TKBビル2階","03-5797-7536","2016/2/1","あん摩、はり、きゅう","35.657405","139.742939"
"こいけ針灸治療所","東京都港区東麻布二丁目5番1‐101",,"03-3585-8462","2020/1/9","あん摩、はり、きゅう","35.657277","139.741699"
"ＳＨＩＮ　ｃｏｎｄｉｔｉｏｎｉｎｇ　ｓｔｕｄｉｏ　鍼灸","東京都港区東麻布二丁目15番1号","AVANSER  AZABU 4階","03-6277-7758","2015/3/7","はり、きゅう","35.657551","139.74097"
"ＢａｌａｎｃｅＨａｒｉ","東京都港区東麻布二丁目23番14号","トワ・イグレッグ304",,"2020/4/4","あん摩、はり、きゅう","35.657102","139.739278"
"鍼灸　春秋泉","東京都港区東麻布三丁目7番4号","4F","03-3560-3838","2010/3/19","はり、きゅう","35.656395","139.738514"
"鍼灸マッサージさとう治療院","東京都港区東麻布三丁目7番13号","MD麻布601号","03-3584-6222","2007/1/16","あん摩、はり、きゅう","35.656335","139.738079"
"やの鍼灸院　麻布十番","東京都港区東麻布三丁目8番8‐601号",,"03-5797-7124","2016/3/18","はり、きゅう","35.656361","139.73763"
"東京インターナショナル鍼灸院","東京都港区東麻布三丁目8番10号","バーリータワーズ1001","03-6277-7063","2016/7/1","あん摩、はり、きゅう","35.656485","139.737491"
"養生鍼灸治療院","東京都港区東麻布三丁目8番10号","バーリータワーズ301","03-3560-6172","2005/11/1","はり、きゅう","35.656485","139.737491"
"麻布治療院","東京都港区東麻布三丁目8番11号","2階","070-4027-6112","2016/11/1","あん摩、はり、きゅう","35.656533","139.73743"
"はりきゅうマッサージ　グローバル治療院　汐留シティセンター","東京都港区東新橋一丁目5番2号","汐留シティセンターB2F","03-6218-0270","2020/2/1","あん摩、はり、きゅう","35.665497","139.760881"
"グローバル治療院汐留シティセンターマッサージ＆鍼灸","東京都港区東新橋一丁目5番2号","汐留シティセンター2階","03-3575-9686","2014/8/12","あん摩、はり、きゅう","35.665497","139.760881"
"富士通ハーモニー汐留オフィスヘルスキーピングルーム","東京都港区東新橋一丁目5番2号","汐留シティーセンター23階PacificOceanAtlanticOcean",,"2021/7/12","あん摩","35.665497","139.760881"
"マンダラ・スパ　ザ　ロイヤルパークホテル　アイコニック　東京汐留","東京都港区東新橋一丁目6番3号","マンダラ・スパ ザ ロイヤルパークホテル 東京汐留地下2階","03-6253-1180","2021/4/15","はり、きゅう","35.664143","139.760593"
"株式会社電通マッサージルーム","東京都港区東新橋一丁目8番1号","電通本社ビル3階","03-6216-5111","2002/12/2","あん摩、はり","35.664377","139.762453"
"ハリアップ　カレッタ汐留院","東京都港区東新橋一丁目8番2号","カレッタ汐留地下2階","03-6215-8017","2005/9/1","あん摩、はり、きゅう","35.664459","139.762522"
"安藤・間リラクゼーションルーム","東京都港区東新橋一丁目9番1号","東京汐留ビルディング3階","03-3575-6086","2022/5/9","あん摩、はり、きゅう","35.662940","139.761215"
"ＣＡＲＮＡ鍼灸院","東京都港区東新橋二丁目5番4号","菅家ビル1階","03-6381-5044","2022/12/1","はり、きゅう","35.662653","139.757681"
"ゆうきマタニティーセラピー女性と子どもの鍼灸マッサージ院","東京都港区三田二丁目12番6号",,"03-6435-1960","2012/8/1","あん摩、はり、きゅう","35.649871","139.744037"
"一会堂鍼灸院","東京都港区三田二丁目14番7号","ローレル三田406",,"2022/11/27","はり、きゅう","35.648594","139.744385"
"鍼灸三田治療院","東京都港区三田二丁目14番7号","ロレール三田301","03-3455-6658","2019/1/1","あん摩、はり、きゅう","35.648594","139.744385"
"マッサージ・はり・きゅう　掌の家","東京都港区三田二丁目19番28号",,,"2014/5/7","あん摩、はり、きゅう","35.649031","139.738298"
"あらい鍼灸院","東京都港区三田三丁目1番14号","MA-21 301号室","03-6805-3783","2006/10/2","はり、きゅう","35.647416","139.74425"
"わかば治療院","東京都港区三田三丁目4番6号","マートルコート三田701","080-3013-2650","2016/6/21","はり、きゅう","35.646554","139.743366"
"ほり鍼灸専門治療室","東京都港区三田三丁目4番18号","二葉ビル804","03-3454-7270","2006/6/6","あん摩、はり、きゅう","35.646594","139.744111"
"中西浩太鍼灸マッサージ治療院","東京都港区三田三丁目7番13号","ハイライフ三田1002号","080-5012-9628","2007/7/12","あん摩、はり、きゅう","35.643255","139.741871"
"みた鍼灸院","東京都港区三田三丁目7番15号","302",,"1993/2/4","あん摩、はり、きゅう","35.643022","139.742049"
"ナチュラルリンク施術所","東京都港区三田四丁目17番26号","パティーナ三田台402",,"2016/2/1","あん摩","35.642233","139.739021"
"東指圧治療院","東京都港区三田四丁目19番21号","405","03-3447-5426","1989/2/25","あん摩","35.640409","139.739751"
"わたなべ治療院","東京都港区三田四丁目19番25号","伊皿子坂ハウス104","03-3444-2272","2001/8/6","あん摩、はり、きゅう","35.640579","139.738953"
"鍼灸治療スタジオ　専心良治","東京都港区三田五丁目6番8号","NAKAMURAビル3階","03-3457-6682","2015/6/22","はり、きゅう","35.646634","139.739817"
"はりきゅう指圧龍源寺ハウス治療院","東京都港区三田五丁目9番15号","龍源寺ハウス","080-8814-6373","2015/8/28","あん摩、はり、きゅう","35.646336","139.737322"
"龍源寺龍翔院観音堂療養院","東京都港区三田五丁目9番15号","2階","03-3572-3335","2010/5/27","はり、きゅう","35.646336","139.737322"
"伊藤忠食糧株式会社ヘルスケアルーム","東京都港区南青山一丁目1番1号","新青山ビル西館21階","03-5771-6369","2015/1/26","あん摩","35.672567","139.724714"
"海江田指圧治療院","東京都港区南青山一丁目3番6号",,"03-3401-9677","1983/1/25","あん摩","35.671532","139.725986"
"はり小児鍼マッサージすみ治療院","東京都港区南青山一丁目9番6号","杉浦ビル2階","03-3401-7783","1996/6/18","あん摩、はり、きゅう","35.670451","139.725717"
"あか羽鍼灸院","東京都港区南青山一丁目15番22号","ヴィラ乃木坂101","03-6804-6200","2010/10/12","あん摩、はり、きゅう","35.668154","139.726515"
"乃木坂エルミタージュ鍼灸院","東京都港区南青山一丁目17番2号","YZCUBE C号館","03-6721-1761","2015/8/15","はり、きゅう","35.668240","139.725845"
"鍼灸マッサージ治療院　ハントクラフト","東京都港区南青山一丁目22番3号","グラン南青山101","03-5775-1558","2009/11/9","あん摩、はり、きゅう","35.666791","139.725261"
"はりきゅうマッサージ治療院らるく","東京都港区南青山一丁目22番3号","グラン南青山102","03-6804-6616","2016/4/5","あん摩、はり、きゅう","35.666791","139.725261"
"Ｍ・メソッド","東京都港区南青山一丁目26番16号","乃木坂リリエンハイム606",,"2020/7/1","はり、きゅう","35.667127","139.726984"
"Ｓｈａｒｅｄ治療院","東京都港区南青山二丁目2番15号","ウィン青山321","070-3183-0323","2016/6/10","はり、きゅう","35.671444","139.723779"
"海音堂　鍼灸マッサージ院","東京都港区南青山二丁目2番15号","ウィン青山923","080-6723-3030","2016/9/5","あん摩、はり、きゅう","35.671444","139.723779"
"菅原指圧治療院","東京都港区南青山二丁目2番15号","ウィン青山1123","03-3405-0530","2002/8/1","あん摩","35.671444","139.723779"
"同門鍼灸院","東京都港区南青山二丁目2番15号","ウィン青山1133",,"2015/12/15","はり、きゅう","35.671444","139.723779"
"鍼灸院　トップライン","東京都港区南青山二丁目2番15号","ウィン青山741号室",,"2017/1/16","はり、きゅう","35.671444","139.723779"
"青山鍼整道","東京都港区南青山二丁目2番15号","ウィン青山830号室","03-6908-4213","2018/7/31","はり、きゅう","35.671444","139.723779"
"ホリスティックスタイル　オズ","東京都港区南青山二丁目2番15-309号",,"03-6435-5258","2020/1/10","はり、きゅう","35.671444","139.723779"
"株式会社メディカルジャパン　青山鍼灸院","東京都港区南青山二丁目4番11号","201号室 ランド南青山","03-6300-4207","2020/11/7","あん摩、はり、きゅう","35.671063","139.723121"
"リラクゼーションルーム「ゆるりら」","東京都港区南青山二丁目5番20号","株式会社帝国データバンク本社ビル10階","03-5775-3000","2009/5/11","あん摩、はり、きゅう","35.672113","139.723187"
"Ｒｅｌａｘａｔｉｏｎ　Ｒｏｏｍ　Ｒａｋｕｍｏｍｉ","東京都港区南青山二丁目6番21号","楽天クリムゾンハウス9階","03-6740-6730","2022/7/19","あん摩、はり、きゅう","35.671818","139.722229"
"青山大橋治療院","東京都港区南青山二丁目7番5号","南青山コンド506","03-3402-1477","2008/7/28","あん摩、はり、きゅう","35.670616","139.722634"
"鍼灸・マッサージ　Ｓｕｎｃａｔｃｈｅｒ","東京都港区南青山二丁目7番5号","南青山コンド501",,"2021/9/13","あん摩、はり、きゅう","35.670616","139.722634"
"＃ＳＦＡ　青山","東京都港区南青山二丁目7番8号","クリアスタイル南青山2階","03-6447-4345","2022/2/23","はり","35.670314","139.723063"
"おおした鍼灸院","東京都港区南青山二丁目9番27号","2A","03-3401-8918","2004/7/12","あん摩、はり、きゅう","35.670692","139.721220"
"キュアトリートメントレミュー青山鍼院","東京都港区南青山二丁目12番15号","ユニマット外苑ビル7階","03-5413-6408","2023/3/30","はり","35.671194","139.720516"
"ヘルスケア青山鍼灸指圧治療院","東京都港区南青山二丁目14番6号",,"03-3403-0925","1988/8/8","あん摩、はり、きゅう","35.670061","139.721111"
"醍醐長生館","東京都港区南青山二丁目18番2号","竹中ツインビルB館地下1階","03-6459-2966","2009/3/12","あん摩","35.669436","139.720320"
"ホリスティックセラピーさいとう治療室","東京都港区南青山二丁目18番20号","301(南青山コンパウンド)","03-3408-1955","2021/6/3","あん摩、はり、きゅう","35.669659","139.720160"
"楠鍼灸治療院","東京都港区南青山二丁目20番1号","平野ビル401号","03-3402-7113","2006/4/25","あん摩、はり、きゅう","35.670375","139.719886"
"ハーツ　トリートメントスペース","東京都港区南青山二丁目21番36号","南青山ガーデンコート201","03-5770-5139","2008/4/18","あん摩、はり、きゅう","35.669435","139.718382"
"田中鍼灸指圧治療院","東京都港区南青山二丁目25番10号","エスト南青山2階","03-3475-4631","2007/6/25","あん摩、はり、きゅう","35.669741","139.718125"
"ＳＣＳＫ青山リラクゼーションルーム","東京都港区南青山二丁目26番1号","SCSK青山ビル2階","03-6438-3901","2014/9/9","あん摩","35.669803","139.717706"
"ＣＳＫ健保鍼灸治療室","東京都港区南青山二丁目26番32号","BC青山ビル501号","03-3478-8393","2003/9/1","はり、きゅう","35.669832","139.717455"
"はり・灸・マッサージアキュ・モード","東京都港区南青山二丁目26番34号","北屋ビル3階","03-3478-8267","2004/6/1","あん摩、はり、きゅう","35.669869","139.716998"
"妙鍼堂　東京外苑前店","東京都港区南青山二丁目26番35号","青山KKビル301","090-5651-9986","2015/1/5","はり、きゅう","35.669932","139.717088"
"ＢｅａｕｔｉＱ","東京都港区南青山二丁目27番20号","植村ビル2階","03-3479-6633","2018/4/21","はり、きゅう","35.668908","139.716482"
"外苑前鍼灸接骨院","東京都港区南青山二丁目27番28号","グラン青山701","03-3475-5288","1987/2/1","はり、きゅう","35.669728","139.716851"
"東京青山メディカルケア鍼灸院","東京都港区南青山二丁目28番4号","フクダビル101","03-6804-5765","2014/9/8","はり、きゅう","35.668506","139.718011"
"Ｒｅ：ｔｒｅａｔ　ＨＡＲｉ","東京都港区南青山二丁目29番8号","フロンティアビルディング南青山5階",,"2023/3/1","あん摩、はり、きゅう","35.667939","139.717859"
"キャプラン株式会社　マッサージルーム","東京都港区南青山三丁目1番31号","NBF南青山ビル2階","03-3497-5567","2014/3/5","あん摩","35.668071","139.715997"
"アール治療院・青山外苑前","東京都港区南青山三丁目1番36号","青山丸竹ビル5階","03-3584-6178","2023/1/6","あん摩、はり、きゅう","35.668681","139.715943"
"はりまる開鍼堂","東京都港区南青山三丁目3番11号","メゾン青山1階5号室",,"2007/6/15","はり、きゅう","35.667250","139.716928"
"南青山東洋医学治療院","東京都港区南青山三丁目3番17号",,"03-3475-5127","2005/6/1","あん摩、はり、きゅう","35.667447","139.716459"
"真暖・鍼灸治療院","東京都港区南青山三丁目3番18号","染谷アパート102",,"2021/5/11","あん摩、はり、きゅう","35.665929","139.714937"
"青山ＢＬＡＮＣ","東京都港区南青山三丁目4番8号","KDXレジデンス南青山401","0120-649-041","2018/11/1","あん摩、はり、きゅう","35.667010","139.717267"
"表参道エル鍼灸マッサージ","東京都港区南青山三丁目7番4号","岩崎ビル2階","03-6804-3465","2012/2/15","あん摩、はり、きゅう","35.666943","139.716499"
"南青山ＰＩＣＳ鍼灸院","東京都港区南青山三丁目8番7号","クレアトゥール南青山301","03-6721-0608","2022/6/1","はり、きゅう","35.667176","139.715851"
"とまり木鍼灸院","東京都港区南青山三丁目12番11号","ボワゼ青山3階","03-5785-0599","2018/7/1","あん摩、はり、きゅう","35.666099","139.713702"
"ＡＣＡＤＥＭＩＡ鍼灸院","東京都港区南青山三丁目12番12号","南青山312ビル601","03-6721-1897","2013/7/10","はり、きゅう","35.666126","139.713823"
"ＲｅＣｕＡ　Ｅｓｐａｃｅ　ｄｅ　Ｂｅａｕｔｅ","東京都港区南青山三丁目12番12号","南青山312ビル802号",,"2021/9/16","あん摩、はり、きゅう","35.666126","139.713823"
"ナチュラルキュア表参道鍼灸院","東京都港区南青山三丁目14番3号","2階","03-5775-2723","2011/1/5","あん摩、はり、きゅう","35.665707","139.714655"
"Ｑｉｎｏｗａ　キノワ","東京都港区南青山三丁目14番8号","1F","03-5771-1277","2007/8/17","あん摩、はり、きゅう","35.665494","139.715302"
"表参道ｙａｍａｍｏｔｏ鍼灸院","東京都港区南青山三丁目14番24号","ピロティ青山303",,"2021/3/19","はり、きゅう","35.665221","139.714733"
"セラ治療院","東京都港区南青山三丁目14番26号","CASA CERENA 3階","03-6721-1710","2014/1/28","あん摩、はり","35.667533","139.713344"
"こきゅう南青山鍼灸院","東京都港区南青山三丁目16番14号","プラサーダ青山401","03-6447-1080","2022/6/15","あん摩、はり、きゅう","35.664402","139.714659"
"こきゅう南青山プレミアム鍼灸院","東京都港区南青山三丁目16番14号","プラサーダ青山402","03-6447-1080","2022/6/15","あん摩、はり、きゅう","35.664402","139.714659"
"はりきゅうマッサージ　グローバル治療院表参道","東京都港区南青山三丁目18番20号","ワークス南青山","03-5775-2503","2020/4/30","あん摩、はり、きゅう","35.665298","139.713028"
"ＢＨＹ鍼灸生花","東京都港区南青山三丁目18番20号","南青山松本ビル7階","03-6447-0585","2010/4/28","はり、きゅう","35.665409","139.713058"
"李哲鍼灸院","東京都港区南青山四丁目1番5号","セントラル第1青山ビル205号室","03-6434-9915","2016/4/22","はり、きゅう","35.667449","139.718763"
"スポーツマッサージブルートリート　平林鍼灸院","東京都港区南青山四丁目1番5号","セントラル第一青山105","03-3408-4155","2014/6/12","あん摩、はり、きゅう","35.667449","139.718763"
"鍼灸治療室ヨハネ","東京都港区南青山四丁目7番17号","グリーンヒル101","03-3403-0792","2010/12/20","あん摩、はり、きゅう","35.666324","139.719053"
"カーラ鍼灸院","東京都港区南青山四丁目9番11号","SEBON南青山102","03-6804-3336","2020/10/31","はり、きゅう","35.667125","139.718405"
"総合治療院テコセンター","東京都港区南青山四丁目9番22号","アウラビル地下1階","03-6804-6466","2017/9/1","あん摩、はり、きゅう","35.666714","139.717432"
"サンサーラ鍼灸治療室","東京都港区南青山四丁目9番27号","ビューネ南青山ヒルズ306","03-3401-0933","2010/3/1","あん摩、はり、きゅう","35.667115","139.718066"
"鍼灸Ｍｅａｄｏｗ","東京都港区南青山四丁目25番1号","2階","050-3559-1588","2022/10/4","あん摩、はり、きゅう","35.663234","139.718342"
"榊指圧治療院","東京都港区南青山五丁目4番5号","211","03-5466-0673","2015/1/19","あん摩","35.662943","139.71458"
"青山マッサージサロン","東京都港区南青山五丁目4番6号","パレロワイヤル南青山104号室",,"2019/7/29","あん摩","35.662766","139.714837"
"三宅指圧治療院","東京都港区南青山五丁目4番44号","ラポール南青山54 108号","03-3499-5909","2020/12/1","あん摩","35.662552","139.71368"
"彩良指圧マッサージ","東京都港区南青山五丁目4番44号","ラポール南青山303","03-6427-4826","2013/6/21","あん摩","35.662552","139.71368"
"十全治療院","東京都港区南青山五丁目6番3号","メゾンブランシュ2-3C","03-3406-0598","1994/3/14","あん摩","35.663795","139.712128"
"Ｌｉｌｔｉｎｇ　Ｂｏｄｙ治療院（リルティングボディ）","東京都港区南青山五丁目6番4号","ハイトリオ南青山204号室","03-3797-1155","2014/2/1","あん摩、はり、きゅう","35.663700","139.712240"
"さやか鍼灸院","東京都港区南青山五丁目6番9号","サウス青山マンション402",,"2019/12/20","はり、きゅう","35.663471","139.712339"
"ポポ東洋医学鍼灸治療院","東京都港区南青山五丁目7番17号","小原流会館地下1階","03-5962-7718","2022/12/12","はり、きゅう","35.662333","139.712707"
"東洋医学鍼灸久志田治療所","東京都港区南青山五丁目10番5号","九曜ビル青山ハイツ703号","03-3797-7522","2021/10/1","はり、きゅう","35.662487","139.711362"
"たけした鍼灸院青山","東京都港区南青山五丁目12番10号","エラン南青山202","03-6805-1423","2011/4/15","あん摩、はり、きゅう","35.661441","139.712627"
"サカキコンサルテーションアンドザアーツ","東京都港区南青山五丁目12番24号","シャトー東洋南青山509","03-3498-7708","2001/4/2","あん摩","35.661234","139.712439"
"Ｃ　ｂｙ　ＣＡＬＩＳＴＡ鍼灸サロン","東京都港区南青山五丁目16番3号","メゾン青南401","03-6427-4366","2015/1/27","あん摩、はり、きゅう","35.661025","139.714374"
"南青山指圧","東京都港区南青山五丁目17番2号","シドニービル1002","03-3400-7785","1984/11/6","あん摩","35.660894","139.714597"
"佐々木マッサージ鍼灸院セントラル南青山店","東京都港区南青山六丁目1番3号","B1","03-5468-1191","2019/11/6","あん摩、はり、きゅう","35.662549","139.716429"
"戸田鍼灸院","東京都港区南青山六丁目2番6号","ハイム青山402","03-3406-1537","2005/1/4","はり、きゅう","35.660994","139.715735"
"日本鍼灸院","東京都港区南青山六丁目2番10号","バックボーンハウス6階",,"2018/7/3","はり、きゅう","35.660934","139.715496"
"１９Ｆａｃｔｏｒｙ","東京都港区南青山六丁目8番3号","701","03-6874-3444","2017/6/27","あん摩、はり、きゅう","35.660058","139.716803"
"クインベル表参道","東京都港区南青山六丁目8番6号","603","03-6427-6007","2022/9/10","きゅう、はり、あん摩","35.659946","139.716689"
"心愛治療院","東京都港区南青山六丁目12番4号","三越南青山ハウス502号","03-3493-2517","2013/7/18","あん摩、はり、きゅう","35.660682","139.715227"
"表参道鍼灸マッサージ治療院　自然なからだ","東京都港区南青山六丁目12番11号","YUKEN南青山302","03-6419-7213","2017/11/7","あん摩、はり、きゅう","35.660373","139.715252"
"アキュハーブ　ａｃｕｈｅｒｂ鍼灸治療室","東京都港区南青山六丁目12番11号","YUKEN南青山402","03-6427-3202","2010/7/30","あん摩、はり、きゅう","35.660373","139.715252"
"鍼　立花　元","東京都港区南青山六丁目15番13号","南青山レジデンス602号",,"2020/5/1","はり、きゅう","35.659450","139.713935"
"紺野トレーナーズオフィス","東京都港区南青山七丁目10番14号","アファン南青山401",,"2021/8/23","あん摩、はり、きゅう","35.658925","139.718524"
"朝日針灸マッサージ治療院","東京都港区南麻布一丁目7番24号","朝日南麻布マンション804","03-3452-3766","2004/1/5","あん摩、はり、きゅう","35.650386","139.737326"
"鍼灸整体治療院薫風","東京都港区南麻布一丁目7番24号","1002","03-5476-0246","2004/5/22","あん摩、はり、きゅう","35.650386","139.737326"
"Ｆｌｏｗ　鍼灸院","東京都港区南麻布一丁目7番28号","ヴァレンティア麻布1階","03-6453-6376","2017/2/20","はり、きゅう","35.650768","139.737110"
"鍼灸サロン　ＣＯＣＯＣＨＩ","東京都港区南麻布二丁目2番28号","ベルメゾン南麻布グランド604","03-3451-7767","2021/6/15","はり、きゅう","35.649819","139.734667"
"川島鍼灸治療院","東京都港区南麻布二丁目3番11号","1117",,"2014/11/10","あん摩、はり、きゅう","35.649483","139.736094"
"ＬＯＯＰＬＥ（ループル）鍼灸マッサージ院南麻布","東京都港区南麻布二丁目5番21号","イデア南麻布1階","03-6435-0625","2021/6/1","あん摩、はり、きゅう","35.650020","139.737024"
"鍼灸サロン　ル　レーヴ","東京都港区南麻布二丁目7番30号","リバーサイド304",,"2019/6/20","はり、きゅう","35.648151","139.736941"
"鍼灸院ＭＡＲ","東京都港区南麻布二丁目8番5号","207","03-6809-5644","2020/8/4","あん摩、はり、きゅう","35.648657","139.735607"
"田島千枝子治療室","東京都港区南麻布三丁目3番13号",,"03-5418-5044","2003/10/6","あん摩","35.650389","139.731580"
"飯野鍼療所","東京都港区南麻布三丁目3番28号","1階","03-6409-6357","2014/2/1","はり、きゅう","35.650175","139.731470"
